<?xml version="1.0" encoding="UTF-8" standalone="no"?>
<!DOCTYPE Tournament SYSTEM "tournament.dtd">
<Tournament dataVersion="201">
<Players/>
<Games/>
<TournamentParameterSet>
<GeneralParameterSet basicTime="60" beginDate="2014-11-10" canByoYomiTime="300" complementaryTimeSystem="STDBYOYOMI" director="Director name" endDate="2014-11-10" fischerTime="10" genMMBar="4D" genMMFloor="20K" genMMS2ValueAbsent="1" genMMS2ValueBye="2" genMMZero="30K" genNBW2ValueAbsent="0" genNBW2ValueBye="2" genRoundDownNBWMMS="true" komi="7.5" location="Location name" name="Tournament name" nbMovesCanTime="15" numberOfCategories="1" numberOfRounds="5" shortName="tournamentshortname" size="19" stdByoYomiTime="30"/>
<HandicapParameterSet hdBasedOnMMS="true" hdCeiling="9" hdCorrection="1" hdNoHdRankThreshold="1D"/>
<PlacementParameterSet>
<PlacementCriteria>
<PlacementCriterion name="MMS" number="1"/>
<PlacementCriterion name="SOSM" number="2"/>
<PlacementCriterion name="SOSOSM" number="3"/>
<PlacementCriterion name="NULL" number="4"/>
<PlacementCriterion name="NULL" number="5"/>
<PlacementCriterion name="NULL" number="6"/>
</PlacementCriteria>
</PlacementParameterSet>
<PairingParameterSet paiBaAvoidDuplGame="500000000000000" paiBaBalanceWB="1000000" paiBaDeterministic="true" paiBaRandom="0" paiMaAdditionalPlacementCritSystem1="Rating" paiMaAdditionalPlacementCritSystem2="NULL" paiMaAvoidMixingCategories="0" paiMaCompensateDUDD="true" paiMaDUDDLowerMode="MID" paiMaDUDDUpperMode="MID" paiMaDUDDWeight="100000000" paiMaLastRoundForSeedSystem1="2" paiMaMaximizeSeeding="5000000" paiMaMinimizeScoreDifference="100000000000" paiMaSeedSystem1="SPLITANDRANDOM" paiSeAvoidSameGeo="100000000000" paiSeBarThresholdActive="true" paiSeDefSecCrit="100000000000" paiSeMinimizeHandicap="0" paiSeNbWinsThresholdActive="false" paiSePreferMMSDiffRatherThanSameClub="3" paiSePreferMMSDiffRatherThanSameClubsGroup="2" paiSePreferMMSDiffRatherThanSameCountry="1" paiSeRankThreshold="1D" paiStandardNX1Factor="0.5"/>
<DPParameterSet displayClCol="true" displayCoCol="true" displayIndGamesInMatches="true" displayNumCol="true" displayPlCol="true" gameFormat="full" playerSortType="name" showByePlayer="true" showNotFinallyRegisteredPlayers="true" showNotPairedPlayers="true" showNotParticipatingPlayers="false" showPlayerClub="true" showPlayerCountry="false" showPlayerGrade="true"/>
<PublishParameterSet exportHFToOGSite="false" exportTFToOGSite="false" exportToLocalFile="true" exportToUDSite="false" htmlAutoScroll="false" print="true"/>
</TournamentParameterSet>
<TeamTournamentParameterSet>
<TeamGeneralParameterSet teamSize="4"/>
<TeamPlacementParameterSet>
<PlacementCriteria>
<PlacementCriterion name="TEAMP" number="1"/>
<PlacementCriterion name="BDW" number="2"/>
<PlacementCriterion name="BDW3U" number="3"/>
<PlacementCriterion name="BDW2U" number="4"/>
<PlacementCriterion name="BDW1U" number="5"/>
<PlacementCriterion name="MNR" number="6"/>
</PlacementCriteria>
</TeamPlacementParameterSet>
</TeamTournamentParameterSet>
</Tournament>
